{
  "$schema": "widget-schema.json",
  "name": "Spotify",
  "url": "https://google.nl/",
  "enabled": false,
  "x": 2,
  "y": 11,
  "width": 15,
  "height": 8,
  "touchEnabled": true,
  "customUserAgent": [
    {
      "domain": "open.spotify.com",
      "userAgent": "Mozilla/5.0 (Android 15; Mobile; rv:133.0) Gecko/133.0 Firefox/133.0"
    }
  ]
}