{
  "$schema": "widget-schema.json",
  "name": "Spotify",
  "url": "https://open.spotify.com",
  "enabled": false,
  "x": 3295,
  "y": 208,
  "width": 832,
  "height": 464,
  "touchEnabled": true,
  "customUserAgent": [
    {
      "domain": "open.spotify.com",
      "userAgent": "Mozilla/5.0 (Android 15; Mobile; rv:133.0) Gecko/133.0 Firefox/133.0"
    }
  ],
  "permissions": {
    "mediaKeySystem": true
  }
}
